Basic Pack 1: WH Questions,Basic Pack 2: FANBOYS & Correlative,Basic Pack 3: Subordinating Conj.,Basic Pack 4: Prep. Time,Basic Pack 5: Prep. Place,Basic Pack 6: Prep. Movement & Other,Basic Pack 7: Possessive & Object Pron.,Basic Pack 8: Quantifiers,Basic Pack 9: Frequency Adverbs,Advanced Pack 1: Used to / Use to,Advanced Pack 2: Comparative Rules,Advanced Pack 3: Superlative Rules,Advanced Pack 4: Idiomatic Expressions,Advanced Pack 5: Possessive Nouns,Advanced Pack 6: Relative Clauses,Advanced Pack 7: Modals of Possibility,Advanced Pack 8: Passive Voice,Pro Pack 1: Inversion,Pro Pack 2: Cleft Sentences,Pro Pack 3: Participle Clauses,Pro Pack 4: Wish & Regret,Pro Pack 5: Double Comparatives
What,for,because,in,in,to,my,some,always,used to,than,the most,break the ice,John's car,who,might,is made,never have I,it was X who,having finished,I wish I had,the more the better
Where,and,although,on,on,into,your,any,usually,didn't use to,more...than,the least,hit the road,my mother's house,which,could,was built,rarely does she,it is Y that,being tired,if only I could,the sooner the better
When,nor,if,at,at,across,his,much,normally,did you use to,less...than,the -est,call it a day,the dog's bone,that,may,are sold,seldom do we,what I need is,not knowing,I wish I were,the harder you work the more you earn
Who,but,since,before,under,through,her,many,often,I used to live,as...as,one of the best,piece of cake,children's toys,where,might have,were found,not only did he,what she said was,having been told,if only they hadn't,the less you worry the happier you are
Why,or,while,after,over,along,its,a lot of,sometimes,she used to work,not as...as,by far the worst,once in a blue moon,the boss's office,when,could have,has been done,hardly had they,the thing that,seen from above,I wish you would,the bigger the risk the bigger the reward
Which,yet,unless,during,between,past,our,a few,occasionally,they used to play,the more...the more,the second largest,under the weather,ladies' room,whose,may have,had been sent,no sooner had I,the reason why,written in English,I regret not,the more I learn the less I know
How,so,after,for,behind,out of,their,a little,never,we didn't use to,much more,the third most,on the same page,men's clothing,whom,can't have,will be finished,little did I know,the place where,left alone,I should have,the older I get the wiser I become
What time,not only,before,since,in front of,up,me,several,every once in a while,he used to be,a lot better,ever,the last straw,someone's phone,the man who,must have,being repaired,under no circumstances,the person who,given the chance,I shouldn't have,the faster you run the more tired you get
How often,either,that's why,until,next to,down,you,enough,once a,it used to cost,far worse,of all,cut corners,everybody's favorite,the book which,should have,been discovered,only then did,all I want is,compared to,if only I knew,the cheaper it is the worse the quality
How much,neither,,,beside,with,him,half,twice a,never used to,slightly bigger,in the world,go the extra mile,nobody's fault,the place where,would have,get paid,at no point,what matters is,based on,I wish it were,more and more
How many,,,,above,about,us,all,every,always used to,a bit cheaper,I've ever seen,sleep on it,each other's,the reason why,might not,got fired,in no way,the way in which,considering that,if only we had,less and less
How long,,,,below,by,them,most,rarely,used to believe,way more expensive,the fastest growing,a blessing in disguise,one another's,the person whose,could not have,being used,on no account,it's not that,judging by,I regret saying,better and better
,,,,,from,,,,,,,,,,,,,,,,
,,,,,of,,,,,,,,,,,,,,,,
,,,,,as,,,,,,,,,,,,,,,,
,,,,,like,,,,,,,,,,,,,,,,
,,,,,against,,,,,,,,,,,,,,,,
,,,,,ahead,,,,,,,,,,,,,,,,
